{
  "schema_version": 4,
  "workflow_decision_hash": "aaaaaaaaaaaaaaaaaaaaaaaaaaaaaaaaaaaaaaaaaaaaaaaaaaaaaaaaaaaaaaaa",
  "task_bindings": [
    {
      "task_id": "TASK-1",
      "work_revision": 1,
      "workflow_decision_hash": "aaaaaaaaaaaaaaaaaaaaaaaaaaaaaaaaaaaaaaaaaaaaaaaaaaaaaaaaaaaaaaaa"
    }
  ],
  "evidence_requirements": {
    "verification": true,
    "review": true,
    "batch_review": false
  },
  "action": "create_review_request",
  "outcome": "CREATE_REVIEW_REQUEST",
  "summary": "Create a review request for the verified task",
  "approval_required": false,
  "approval_kind": "automatic",
  "approval_reference": null,
  "cleanup": "KEEP"
}
